[
  {
    "camera_id": "casio_exilim_ex_h20g",
    "display_name": "Casio Exilim EX-H20G",
    "brand": "Casio",
    "aliases_found": [],
    "battery_model": "NP-90",
    "battery_brand": "Casio",
    "chemistry": "lithium-ion",
    "voltage": null,
    "capacity_mah": null,
    "status": "fully_compatible",
    "quantity_required": 1,
    "evidence_level": "verified_medium",
    "source_type": "trusted_database",
    "source_name": "DPReview Casio Exilim EX-H20G specifications",
    "source_url": "https://www.dpreview.com/products/casio/compacts/casio_exh20g/specification",
    "source_text": "DPReview specifications for Casio Exilim EX-H20G: Battery description: Lithium-Ion NP-90 battery and charger.",
    "cross_sources": [],
    "decision": "promote_verified",
    "notes": "Exact camera and battery field confirmed in DPReview specifications."
  },
  {
    "camera_id": "casio_exilim_ex_fh25",
    "display_name": "Casio Exilim EX-FH25",
    "brand": "Casio",
    "aliases_found": [],
    "battery_model": "AA",
    "battery_brand": "Generic",
    "chemistry": "various",
    "voltage": null,
    "capacity_mah": null,
    "status": "uses_aa",
    "quantity_required": 4,
    "evidence_level": "verified_medium",
    "source_type": "trusted_database",
    "source_name": "DPReview Casio Exilim EX-FH25 specifications",
    "source_url": "https://www.dpreview.com/products/casio/compacts/casio_exfh25/specifications",
    "source_text": "DPReview specifications for Casio Exilim EX-FH25: Battery description: 4 x AA batteries (NiMH, alkaline battery).",
    "cross_sources": [],
    "decision": "promote_verified",
    "notes": "Exact AA quantity is explicitly stated by the source."
  },
  {
    "camera_id": "casio_exilim_ex_p700",
    "display_name": "Casio Exilim EX-P700",
    "brand": "Casio",
    "aliases_found": [],
    "battery_model": "NP-40",
    "battery_brand": "Casio",
    "chemistry": "lithium-ion",
    "voltage": 3.7,
    "capacity_mah": 1230,
    "status": "fully_compatible",
    "quantity_required": 1,
    "evidence_level": "verified_medium",
    "source_type": "trusted_database",
    "source_name": "DPReview Casio EXILIM Pro EX-P700 review",
    "source_url": "https://www.dpreview.com/reviews/casioexp700/3",
    "source_text": "DPReview review for Casio Exilim EX-P700: The battery used is the NP-40 Lithium-Ion rechargeable, 1230 mAh at 3.7 V.",
    "cross_sources": [],
    "decision": "promote_verified",
    "notes": "The review identifies the exact camera and installed battery."
  },
  {
    "camera_id": "casio_exilim_ex_z120",
    "display_name": "Casio Exilim EX-Z120",
    "brand": "Casio",
    "aliases_found": [],
    "battery_model": "AA",
    "battery_brand": "Generic",
    "chemistry": "various",
    "voltage": null,
    "capacity_mah": null,
    "status": "uses_aa",
    "quantity_required": 2,
    "evidence_level": "verified_medium",
    "source_type": "trusted_database",
    "source_name": "DPReview Casio Exilim EX-Z120 specifications",
    "source_url": "https://www.dpreview.com/products/casio/compacts/casio_exz120/specifications",
    "source_text": "DPReview specifications for Casio Exilim EX-Z120: Battery description: AA (2) batteries (NiMH included).",
    "cross_sources": [],
    "decision": "promote_verified",
    "notes": "Exact AA quantity is explicitly stated by the source."
  },
  {
    "camera_id": "fujifilm_finepix_s1",
    "display_name": "Fujifilm FinePix S1",
    "brand": "Fujifilm",
    "aliases_found": [],
    "battery_model": "NP-85",
    "battery_brand": "Fujifilm",
    "chemistry": "lithium-ion",
    "voltage": null,
    "capacity_mah": null,
    "status": "fully_compatible",
    "quantity_required": 1,
    "evidence_level": "verified_medium",
    "source_type": "trusted_database",
    "source_name": "DPReview Fujifilm FinePix S1 specifications",
    "source_url": "https://www.dpreview.com/products/fujifilm/compacts/fujifilm_s1/specifications",
    "source_text": "DPReview specifications for Fujifilm FinePix S1: Battery description: NP-85 lithium-ion battery and charger.",
    "cross_sources": [],
    "decision": "promote_verified",
    "notes": "Exact camera and battery field confirmed in DPReview specifications."
  },
  {
    "camera_id": "fujifilm_finepix_hs10",
    "display_name": "Fujifilm FinePix HS10",
    "brand": "Fujifilm",
    "aliases_found": [
      "FinePix HS11"
    ],
    "battery_model": "AA",
    "battery_brand": "Generic",
    "chemistry": "various",
    "voltage": null,
    "capacity_mah": null,
    "status": "uses_aa",
    "quantity_required": 4,
    "evidence_level": "verified_medium",
    "source_type": "trusted_database",
    "source_name": "DPReview Fujifilm FinePix HS10 specifications",
    "source_url": "https://www.dpreview.com/products/fujifilm/compacts/fujifilm_hs10/specifications",
    "source_text": "DPReview specifications for Fujifilm FinePix HS10 (FinePix HS11): Battery description: 4 x AA batteries.",
    "cross_sources": [],
    "decision": "promote_verified",
    "notes": "The source includes the regional HS11 name and exact AA quantity."
  },
  {
    "camera_id": "fujifilm_finepix_hs35exr",
    "display_name": "Fujifilm FinePix HS35EXR",
    "brand": "Fujifilm",
    "aliases_found": [],
    "battery_model": "NP-W126",
    "battery_brand": "Fujifilm",
    "chemistry": "lithium-ion",
    "voltage": null,
    "capacity_mah": null,
    "status": "fully_compatible",
    "quantity_required": 1,
    "evidence_level": "verified_medium",
    "source_type": "trusted_database",
    "source_name": "DPReview Fujifilm FinePix HS35EXR specifications",
    "source_url": "https://www.dpreview.com/products/fujifilm/compacts/fujifilm_hs35exr/specifications",
    "source_text": "DPReview specifications for Fujifilm FinePix HS35EXR: Battery description: Li-ion NP-W126 battery and charger.",
    "cross_sources": [],
    "decision": "promote_verified",
    "notes": "Exact camera and battery field confirmed in DPReview specifications."
  },
  {
    "camera_id": "fujifilm_finepix_real_3d_w1",
    "display_name": "Fujifilm FinePix Real 3D W1",
    "brand": "Fujifilm",
    "aliases_found": [],
    "battery_model": "NP-95",
    "battery_brand": "Fujifilm",
    "chemistry": "lithium-ion",
    "voltage": null,
    "capacity_mah": null,
    "status": "fully_compatible",
    "quantity_required": 1,
    "evidence_level": "verified_medium",
    "source_type": "trusted_database",
    "source_name": "DPReview Fujifilm FinePix Real 3D W1 specifications",
    "source_url": "https://www.dpreview.com/products/fujifilm/compacts/fujifilm_w1/specifications",
    "source_text": "DPReview specifications for Fujifilm FinePix Real 3D W1: Battery description: Lithium-ion NP-95 rechargeable battery and charger.",
    "cross_sources": [],
    "decision": "promote_verified",
    "notes": "Exact camera and battery field confirmed in DPReview specifications."
  },
  {
    "camera_id": "fujifilm_finepix_s2950",
    "display_name": "Fujifilm FinePix S2950",
    "brand": "Fujifilm",
    "aliases_found": [
      "FinePix S2990"
    ],
    "battery_model": "AA",
    "battery_brand": "Generic",
    "chemistry": "various",
    "voltage": null,
    "capacity_mah": null,
    "status": "uses_aa",
    "quantity_required": 4,
    "evidence_level": "verified_medium",
    "source_type": "trusted_database",
    "source_name": "DPReview Fujifilm FinePix S2950 specifications",
    "source_url": "https://www.dpreview.com/products/fujifilm/compacts/fujifilm_s2950/specifications",
    "source_text": "DPReview specifications for Fujifilm FinePix S2950 (FinePix S2990): Battery: AA; Battery description: 4 x Alkaline batteries.",
    "cross_sources": [],
    "decision": "promote_verified",
    "notes": "The source includes the S2990 regional name and exact AA quantity."
  },
  {
    "camera_id": "fujifilm_finepix_s9000",
    "display_name": "Fujifilm FinePix S9000",
    "brand": "Fujifilm",
    "aliases_found": [
      "Fujifilm FinePix S9000 Zoom"
    ],
    "battery_model": "AA",
    "battery_brand": "Generic",
    "chemistry": "various",
    "voltage": null,
    "capacity_mah": null,
    "status": "uses_aa",
    "quantity_required": 4,
    "evidence_level": "verified_medium",
    "source_type": "trusted_database",
    "source_name": "DPReview Fujifilm FinePix S9000/S9500 specifications",
    "source_url": "https://www.dpreview.com/products/fujifilm/compacts/fuji_finepixs9000z/specifications",
    "source_text": "DPReview specifications for Fujifilm FinePix S9000 Zoom (FinePix S9500): Battery description: AA NiMH (4) batteries included.",
    "cross_sources": [],
    "decision": "promote_verified",
    "notes": "Source states the S9000/S9500 equivalent naming and exact AA quantity."
  },
  {
    "camera_id": "fujifilm_finepix_s9500",
    "display_name": "Fujifilm FinePix S9500",
    "brand": "Fujifilm",
    "aliases_found": [],
    "battery_model": "AA",
    "battery_brand": "Generic",
    "chemistry": "various",
    "voltage": null,
    "capacity_mah": null,
    "status": "uses_aa",
    "quantity_required": 4,
    "evidence_level": "verified_medium",
    "source_type": "trusted_database",
    "source_name": "DPReview Fujifilm FinePix S9000/S9500 specifications",
    "source_url": "https://www.dpreview.com/products/fujifilm/compacts/fuji_finepixs9000z/specifications",
    "source_text": "DPReview specifications for FinePix S9500 (Fujifilm FinePix S9000 Zoom): Battery description: AA NiMH (4) batteries included.",
    "cross_sources": [],
    "decision": "promote_verified",
    "notes": "Source states the S9000/S9500 equivalent naming and exact AA quantity."
  },
  {
    "camera_id": "fujifilm_finepix_z900exr",
    "display_name": "Fujifilm FinePix Z900EXR",
    "brand": "Fujifilm",
    "aliases_found": [],
    "battery_model": "NP-45A",
    "battery_brand": "Fujifilm",
    "chemistry": "lithium-ion",
    "voltage": null,
    "capacity_mah": null,
    "status": "fully_compatible",
    "quantity_required": 1,